"Epic","Feature","Story","FAILED","BROKEN","PASSED","SKIPPED","UNKNOWN"
"","form page: test chai form","","0","42","837","111","31"
"","Test End to End User from resttest: Validate End to End Get Single User","","3","9","184","14","0"
"","Home Page: Home page area","","0","14","26","1","0"
"","The Internet Guinea Pig Website: As a user, I can log into the secure area","","0","28","48","14","0"
"","Halaman Pendaftaran Retribusi Kendaraan: As a user, I can log into the secure area","","1","0","29","0","0"
"","login page: input username password","","0","2","13","6","0"
"","login page: home page","","0","8","8","0","0"
